{
    "$schema": "http://json-schema.org/draft-04/schema#",
    "type": "array",
    "items": {
        "type": "object",
        "properties": {
            "selfId": {
                "type": "integer"
            },
            "name": {
                "type": "string"
            },
            "passive": {
                "type": "boolean"
            },
            "hitTime": {
                "type": "integer"
            },
            "reuseTime": {
                "type": "integer"
            }
        },
        "required": [
            "selfId",
            "name",
            "passive",
            "hitTime",
            "reuseTime"
        ]
    }
}
